{
  "schemaVersion": 1,
  "updatedAt": "2026-09-07",
  "defaults": {
    "reasoning": {
      "defaultEffort": "medium"
    },
    "thinking": {
      "default": false
    }
  },
  "models": {
    "claude-fable-5": {
      "label": "Fable 5",
      "aliases": null,
      "vendor": "anthropic",
      "contextWindow": 1000000,
      "maxOutputTokens": 128000,
      "reasoning": {
        "supported": null,
        "efforts": [
          "low",
          "medium",
          "high",
          "xhigh",
          "max"
        ],
        "defaultEffort": "medium"
      },
      "thinking": {
        "supported": null,
        "modes": [
          "adaptive"
        ],
        "alwaysOn": true,
        "defaultBudgetTokens": 0
      },
      "pricing": {
        "input": 10,
        "output": 50,
        "cacheRead": 0.25,
        "cacheWrite5m": 12.5,
        "cacheWrite1h": 20,
        "note": ""
      }
    },
    "claude-fable-5-1": {
      "label": "Fable 5.1",
      "aliases": null,
      "vendor": "anthropic",
      "contextWindow": 1000000,
      "maxOutputTokens": 128000,
      "reasoning": {
        "supported": null,
        "efforts": [
          "low",
          "medium",
          "high",
          "xhigh",
          "max"
        ],
        "defaultEffort": "medium"
      },
      "thinking": {
        "supported": null,
        "modes": [
          "adaptive"
        ],
        "alwaysOn": true,
        "defaultBudgetTokens": 0
      },
      "pricing": {
        "input": 10,
        "output": 50,
        "cacheRead": 0.25,
        "cacheWrite5m": 12.5,
        "cacheWrite1h": 20,
        "note": ""
      }
    },
    "claude-haiku-4-5-20251001": {
      "label": "Haiku 4.5",
      "aliases": [
        "claude-haiku-4-5"
      ],
      "vendor": "anthropic",
      "contextWindow": 200000,
      "maxOutputTokens": 64000,
      "reasoning": {
        "supported": false,
        "efforts": null,
        "defaultEffort": ""
      },
      "thinking": {
        "supported": null,
        "modes": [
          "enabled",
          "disabled"
        ],
        "alwaysOn": false,
        "defaultBudgetTokens": 10000
      },
      "pricing": {
        "input": 1,
        "output": 5,
        "cacheRead": 0.1,
        "cacheWrite5m": 1.25,
        "cacheWrite1h": 2,
        "note": ""
      }
    },
    "claude-opus-4-5-20251101": {
      "label": "Opus 4.5",
      "aliases": null,
      "vendor": "anthropic",
      "contextWindow": 200000,
      "maxOutputTokens": 64000,
      "reasoning": {
        "supported": null,
        "efforts": [
          "low",
          "medium",
          "high"
        ],
        "defaultEffort": "medium"
      },
      "thinking": {
        "supported": null,
        "modes": [
          "enabled",
          "disabled"
        ],
        "alwaysOn": false,
        "defaultBudgetTokens": 10000
      },
      "pricing": {
        "input": 5,
        "output": 25,
        "cacheRead": 0.5,
        "cacheWrite5m": 6.25,
        "cacheWrite1h": 10,
        "note": ""
      }
    },
    "claude-opus-4-6": {
      "label": "Opus 4.6",
      "aliases": null,
      "vendor": "anthropic",
      "contextWindow": 200000,
      "maxOutputTokens": 64000,
      "reasoning": {
        "supported": null,
        "efforts": [
          "low",
          "medium",
          "high",
          "max"
        ],
        "defaultEffort": "medium"
      },
      "thinking": {
        "supported": null,
        "modes": [
          "adaptive",
          "enabled",
          "disabled"
        ],
        "alwaysOn": false,
        "defaultBudgetTokens": 0
      },
      "pricing": {
        "input": 5,
        "output": 25,
        "cacheRead": 0.5,
        "cacheWrite5m": 6.25,
        "cacheWrite1h": 10,
        "note": ""
      }
    },
    "claude-opus-4-7": {
      "label": "Opus 4.7",
      "aliases": null,
      "vendor": "anthropic",
      "contextWindow": 1000000,
      "maxOutputTokens": 64000,
      "reasoning": {
        "supported": null,
        "efforts": [
          "low",
          "medium",
          "high",
          "xhigh",
          "max"
        ],
        "defaultEffort": "medium"
      },
      "thinking": {
        "supported": null,
        "modes": [
          "adaptive"
        ],
        "alwaysOn": false,
        "defaultBudgetTokens": 0
      },
      "pricing": {
        "input": 5,
        "output": 25,
        "cacheRead": 0.5,
        "cacheWrite5m": 6.25,
        "cacheWrite1h": 10,
        "note": ""
      }
    },
    "claude-opus-4-8": {
      "label": "Opus 4.8",
      "aliases": null,
      "vendor": "anthropic",
      "contextWindow": 200000,
      "maxOutputTokens": 64000,
      "reasoning": {
        "supported": null,
        "efforts": [
          "low",
          "medium",
          "high",
          "xhigh",
          "max"
        ],
        "defaultEffort": "medium"
      },
      "thinking": {
        "supported": null,
        "modes": [
          "adaptive"
        ],
        "alwaysOn": false,
        "defaultBudgetTokens": 0
      },
      "pricing": {
        "input": 5,
        "output": 25,
        "cacheRead": 0.5,
        "cacheWrite5m": 6.25,
        "cacheWrite1h": 10,
        "note": ""
      }
    },
    "claude-opus-5": {
      "label": "Opus 5",
      "aliases": null,
      "vendor": "anthropic",
      "contextWindow": 1000000,
      "maxOutputTokens": 128000,
      "reasoning": {
        "supported": null,
        "efforts": [
          "low",
          "medium",
          "high",
          "xhigh",
          "max"
        ],
        "defaultEffort": "medium"
      },
      "thinking": {
        "supported": null,
        "modes": [
          "adaptive"
        ],
        "alwaysOn": true,
        "defaultBudgetTokens": 0
      },
      "pricing": {
        "input": 5,
        "output": 25,
        "cacheRead": 0.5,
        "cacheWrite5m": 6.25,
        "cacheWrite1h": 10,
        "note": ""
      }
    },
    "claude-sonnet-4-5": {
      "label": "Sonnet 4.5",
      "aliases": null,
      "vendor": "anthropic",
      "contextWindow": 200000,
      "maxOutputTokens": 64000,
      "reasoning": {
        "supported": false,
        "efforts": null,
        "defaultEffort": ""
      },
      "thinking": {
        "supported": null,
        "modes": [
          "enabled",
          "disabled"
        ],
        "alwaysOn": false,
        "defaultBudgetTokens": 10000
      },
      "pricing": {
        "input": 3,
        "output": 15,
        "cacheRead": 0.3,
        "cacheWrite5m": 3.75,
        "cacheWrite1h": 6,
        "note": ""
      }
    },
    "claude-sonnet-4-6": {
      "label": "Sonnet 4.6",
      "aliases": null,
      "vendor": "anthropic",
      "contextWindow": 1000000,
      "maxOutputTokens": 64000,
      "reasoning": {
        "supported": null,
        "efforts": [
          "low",
          "medium",
          "high",
          "max"
        ],
        "defaultEffort": "medium"
      },
      "thinking": {
        "supported": null,
        "modes": [
          "adaptive",
          "enabled",
          "disabled"
        ],
        "alwaysOn": false,
        "defaultBudgetTokens": 0
      },
      "pricing": {
        "input": 3,
        "output": 15,
        "cacheRead": 0.3,
        "cacheWrite5m": 3.75,
        "cacheWrite1h": 6,
        "note": ""
      }
    },
    "claude-sonnet-5": {
      "label": "Sonnet 5",
      "aliases": null,
      "vendor": "anthropic",
      "contextWindow": 1000000,
      "maxOutputTokens": 128000,
      "reasoning": {
        "supported": null,
        "efforts": [
          "low",
          "medium",
          "high",
          "xhigh",
          "max"
        ],
        "defaultEffort": "medium"
      },
      "thinking": {
        "supported": null,
        "modes": [
          "adaptive"
        ],
        "alwaysOn": true,
        "defaultBudgetTokens": 0
      },
      "pricing": {
        "input": 2,
        "output": 10,
        "cacheRead": 0.2,
        "cacheWrite5m": 2.5,
        "cacheWrite1h": 4,
        "note": ""
      }
    },
    "gpt-4o": {
      "label": "GPT-4o",
      "aliases": null,
      "vendor": "openai",
      "contextWindow": 128000,
      "maxOutputTokens": 16384,
      "reasoning": {
        "supported": false,
        "efforts": null,
        "defaultEffort": ""
      },
      "thinking": {
        "supported": false,
        "modes": null,
        "alwaysOn": null,
        "defaultBudgetTokens": 0
      },
      "pricing": {
        "input": 2.5,
        "output": 10,
        "cacheRead": 1.25,
        "cacheWrite5m": null,
        "cacheWrite1h": null,
        "note": ""
      }
    },
    "gpt-4o-mini": {
      "label": "GPT-4o Mini",
      "aliases": null,
      "vendor": "openai",
      "contextWindow": 128000,
      "maxOutputTokens": 16384,
      "reasoning": {
        "supported": false,
        "efforts": null,
        "defaultEffort": ""
      },
      "thinking": {
        "supported": false,
        "modes": null,
        "alwaysOn": null,
        "defaultBudgetTokens": 0
      },
      "pricing": {
        "input": 0.15,
        "output": 0.6,
        "cacheRead": 0.075,
        "cacheWrite5m": null,
        "cacheWrite1h": null,
        "note": ""
      }
    },
    "gpt-5": {
      "label": "GPT-5",
      "aliases": null,
      "vendor": "openai",
      "contextWindow": 400000,
      "maxOutputTokens": 128000,
      "reasoning": {
        "supported": null,
        "efforts": [
          "minimal",
          "low",
          "medium",
          "high"
        ],
        "defaultEffort": "medium"
      },
      "thinking": {
        "supported": false,
        "modes": null,
        "alwaysOn": null,
        "defaultBudgetTokens": 0
      },
      "pricing": {
        "input": 1.25,
        "output": 10,
        "cacheRead": 0.125,
        "cacheWrite5m": null,
        "cacheWrite1h": null,
        "note": ""
      }
    },